{
  "schemaVersion": 2,
  "releaseVersion": "2026.08.29-candidate",
  "buildEpoch": 1787961600,
  "launchPath": "index.html",
  "builder": {
    "name": "tools/release/release.py",
    "version": 1
  },
  "policy": {
    "path": "data/release-policy.json",
    "sha256": "7b12f2d563e3d29b20349974e6be0f5e87f925f67aed92113bfc6e6eeddd759d"
  },
  "provenance": {
    "contentManifest": {
      "path": "data/content-manifest.json",
      "sha256": "3eb9183198bd4e93d108f74b02b59dc38caf9e3f85cb39497a290d3cc36f05ee",
      "contentHash": "656f93409d33fbbd50425a305b0034cb8518cb91b05246c70501eccceec8b591"
    },
    "sourceDocx": {
      "path": "CoHocLyThuyet_Full_New.docx",
      "sha256": "6396a72512613f867f93332968fc876daccb1d65ed3b6d52efaa74d44bf4b79a"
    },
    "thirdParty": [
      {
        "name": "KaTeX",
        "version": "0.16.11",
        "license": "MIT",
        "source": "https://github.com/KaTeX/KaTeX"
      },
      {
        "name": "Three.js",
        "version": "0.160.1",
        "license": "MIT",
        "source": "https://github.com/mrdoob/three.js"
      },
      {
        "name": "Matter.js",
        "version": "0.19.0",
        "license": "MIT",
        "source": "https://github.com/liabru/matter-js"
      },
      {
        "name": "Chart.js",
        "version": "4.5.1",
        "license": "MIT",
        "source": "https://github.com/chartjs/Chart.js"
      },
      {
        "name": "PDF.js",
        "version": "6.2.108",
        "license": "Apache-2.0",
        "source": "https://github.com/mozilla/pdf.js/releases/tag/v6.2.108"
      }
    ],
    "sourcePdf": {
      "path": "CoHocLyThuyet.pdf",
      "sha256": "b755b06cf919a979e278f635aa2fedfe249a97342ccd93d2d15875e87ff835d9"
    }
  },
  "exclusions": [
    {
      "path": "CoHocLyThuyet_Full_New.docx",
      "reason": "authoring source, not runtime content"
    },
    {
      "path": "DeCuongChiTietNop.docx",
      "reason": "submission report source, not runtime content"
    },
    {
      "path": "tests",
      "reason": "development-only verification"
    },
    {
      "path": "tools",
      "reason": "authoring and build tooling"
    },
    {
      "path": "plans",
      "reason": "project management records"
    },
    {
      "path": "release",
      "reason": "historical releases must not contaminate a new package"
    },
    {
      "path": "node_modules",
      "reason": "development dependencies"
    },
    {
      "path": "package-lock.json",
      "reason": "development dependency lock"
    }
  ],
  "files": [
    {
      "path": ".nojekyll",
      "sizeBytes": 2,
      "sha256": "7eb70257593da06f682a3ddda54a9d260d4fc514f645237f5ca74b08f8da61a6"
    },
    {
      "path": "CoHocLyThuyet.pdf",
      "sizeBytes": 4745404,
      "sha256": "b755b06cf919a979e278f635aa2fedfe249a97342ccd93d2d15875e87ff835d9"
    },
    {
      "path": "assets/gifs/ch1/hinh-1-06.gif",
      "sizeBytes": 1987184,
      "sha256": "fd557ca9f9aac7f46a3fef7b08a006a6422f2cc8d33073d43c43f08d3f095d41"
    },
    {
      "path": "assets/gifs/ch1/hinh-1-09.gif",
      "sizeBytes": 3418215,
      "sha256": "565fa37e55e33595c796c054cc5ffd7c1d9726d65f5c4560159cae728468826f"
    },
    {
      "path": "assets/gifs/ch1/hinh-1-28b.gif",
      "sizeBytes": 2727504,
      "sha256": "f7bb4009da2c272873d3d6e276db7ee3c941b380f48660f80ca6b688737857fb"
    },
    {
      "path": "assets/gifs/ch1/hinh-1-34.gif",
      "sizeBytes": 1796111,
      "sha256": "49e793727467fbb7b86a34f07f7ee38bcf354b3ee3cf854d9a8ef31313917eb6"
    },
    {
      "path": "assets/gifs/ch1/hinh-1-35.gif",
      "sizeBytes": 2571674,
      "sha256": "92f9bb414e9a77df6a86b518fe1335d4b87e27bd12fd4c588cd4c5d0a85ab9f8"
    },
    {
      "path": "assets/gifs/ch1/hinh-1-minh-hoa-02.gif",
      "sizeBytes": 2620774,
      "sha256": "569f6f0ebe3295f3585ae719a15440886c1faebc4a4c7d3ae35caa875200a799"
    },
    {
      "path": "assets/gifs/ch2/hinh-2-07.gif",
      "sizeBytes": 1796601,
      "sha256": "7df3468132a79abfa140eb99ccbe172a61b0b2c137ee4ac2cbfe38ccea8d22b6"
    },
    {
      "path": "assets/gifs/ch2/hinh-2-09.gif",
      "sizeBytes": 2407941,
      "sha256": "6de9b5bcc6abb7ed07ce8e736050ed497990ae870f9a25b3303753f3707d0e3c"
    },
    {
      "path": "assets/gifs/ch2/hinh-2-15.gif",
      "sizeBytes": 3771048,
      "sha256": "92c6bd4aaae1cbc4d6a2550dcdb2f742220e548b84dfcdfefc45ba5970f64fdb"
    },
    {
      "path": "assets/gifs/ch2/hinh-2-16.gif",
      "sizeBytes": 2655013,
      "sha256": "8c48cf82f40b45f1f4bf0d3be861707316673a57bb294b7278dc6ec9c657f0de"
    },
    {
      "path": "assets/gifs/ch2/hinh-2-22.gif",
      "sizeBytes": 2648517,
      "sha256": "25c5e0711792aa788c4a280e51c5023ec7233e9ec98392db675bc24005a8219f"
    },
    {
      "path": "assets/gifs/ch2/hinh-2-26.gif",
      "sizeBytes": 2279029,
      "sha256": "879943a438dc0411dfe0b36d4948096e158cc3f8aa8abddd798c27abaa501dfd"
    },
    {
      "path": "assets/gifs/ch2/hinh-2-34.gif",
      "sizeBytes": 2708215,
      "sha256": "965399585cb015fbfdfdab0bee7881b25e45b10424724ab1dee30c92fba22525"
    },
    {
      "path": "assets/gifs/ch3/hinh-3-06.gif",
      "sizeBytes": 2687445,
      "sha256": "dc477653122d6e3b77bd3a04edcad48f17f08db513f8dfa68900d9df423234b4"
    },
    {
      "path": "assets/gifs/ch3/hinh-3-10.gif",
      "sizeBytes": 2129464,
      "sha256": "519e8fa026e1c6b6af9db62065b6fa7c5665596d9130fe641653653515266a3b"
    },
    {
      "path": "assets/gifs/ch3/hinh-3-11.gif",
      "sizeBytes": 2353312,
      "sha256": "b272cde84014d15cd564d13871c6571ea6b5b97ceed4b6f72001615dec099ea8"
    },
    {
      "path": "assets/gifs/ch3/hinh-3-17.gif",
      "sizeBytes": 2325173,
      "sha256": "24b005861085c2ca4b2545d33744ac85323136b872e730dcc597e9578b994231"
    },
    {
      "path": "assets/gifs/ch3/hinh-3-20.gif",
      "sizeBytes": 2858509,
      "sha256": "5e58ce8aef143f75756ae413e2583de121f951bb030e8d0e477f8814e89aaf4b"
    },
    {
      "path": "assets/gifs/ch3/hinh-3-21.gif",
      "sizeBytes": 2569777,
      "sha256": "5954b7180631762523b18f5317c4bda28d58a1d8d0a6c6ae84d1ea3668db3da6"
    },
    {
      "path": "assets/gifs/ch3/hinh-3-22.gif",
      "sizeBytes": 3214544,
      "sha256": "92455faff8d4d3315dd1219f8cde84fc15bd862a90546555ba91dacd902f6b20"
    },
    {
      "path": "chapters/ch1/cau-hoi-on-tap.html",
      "sizeBytes": 542,
      "sha256": "f2316f03293c7fd458d0fd988785b336f0e453f4e77f0ed29c2d37b846b4d5ef"
    },
    {
      "path": "chapters/ch1/index.html",
      "sizeBytes": 7080,
      "sha256": "49636fc87f0d9ee15e499fb35d2d3045e131b87202f38b8cc6839ecb91a70a60"
    },
    {
      "path": "chapters/ch1/muc-I-1.html",
      "sizeBytes": 1080,
      "sha256": "1f7f2d55023e2b5b6f0f648c78e7397080a4a3dadba241b6f0ecab0db334ea2f"
    },
    {
      "path": "chapters/ch1/muc-I-2.html",
      "sizeBytes": 1383,
      "sha256": "903a38878c2a8808aa00d715130294f7e6f23f94221071e925fc6c3ff8f21c6b"
    },
    {
      "path": "chapters/ch1/muc-I-3.html",
      "sizeBytes": 2827,
      "sha256": "689fa55176e75f740b4d859a728945aa44a17811095ab6bdce59ba1f353b26d3"
    },
    {
      "path": "chapters/ch1/muc-I-4.html",
      "sizeBytes": 8315,
      "sha256": "22f172584462750768495d92e24a133aa2866af1328567d7358476de7b671637"
    },
    {
      "path": "chapters/ch1/muc-I-5.html",
      "sizeBytes": 11313,
      "sha256": "7dbcbb9258c8112b45a48d4e60cf018728b130a08b395731b675de2a1206ce70"
    },
    {
      "path": "chapters/ch1/muc-I-6.html",
      "sizeBytes": 1893,
      "sha256": "940acf95dd49e5d02b5a2d4b985f136345438ea2ef78264ba7bb34da1eb8f4da"
    },
    {
      "path": "chapters/ch1/muc-I-7.html",
      "sizeBytes": 1236,
      "sha256": "da0af0f1de5e20abb8a1186b386d0b5b363ee0e5365ca18fc11314365ade4b96"
    },
    {
      "path": "chapters/ch1/muc-I-8.html",
      "sizeBytes": 1209,
      "sha256": "8c94298c25aeaf14280ec6b06509281da8754d0b473e3eba5e5a71cb1bb4e394"
    },
    {
      "path": "chapters/ch1/muc-I.html",
      "sizeBytes": 1207,
      "sha256": "49e58750cde423435632a9b7bc47396f2f7cc55a3f5096f623a712843c7d9acc"
    },
    {
      "path": "chapters/ch1/muc-II-1.html",
      "sizeBytes": 1112,
      "sha256": "e7375dbaf0d92d4e52344a0746fccbeae9c900dea2b06137ed8a54a2266d671f"
    },
    {
      "path": "chapters/ch1/muc-II-2.html",
      "sizeBytes": 13425,
      "sha256": "9465cd463c34aca38a3abdbb2a89f30af2984d15a5afc9941a547aba4d49724f"
    },
    {
      "path": "chapters/ch1/muc-II-3.html",
      "sizeBytes": 1505,
      "sha256": "d81b23c9991c41083fe63a4cc47a4b0ab5e707bd3667ce5b1cf6203d112247ad"
    },
    {
      "path": "chapters/ch1/muc-II-4.html",
      "sizeBytes": 963,
      "sha256": "dc264e9b186e73eec2b787190932b44b680325e0b654eb6cf0621fb972784a98"
    },
    {
      "path": "chapters/ch1/muc-II-5.html",
      "sizeBytes": 1602,
      "sha256": "24a52e1ffbd766ecf0c286adfdc34c8d28b63e003d838179e609c8c92ecb78e2"
    },
    {
      "path": "chapters/ch1/muc-II-6.html",
      "sizeBytes": 1294,
      "sha256": "15f3f98f3c82b9d12e61774da6e922de788402142e8829bc9ed80b98b5868b30"
    },
    {
      "path": "chapters/ch1/muc-II.html",
      "sizeBytes": 925,
      "sha256": "1f3ae29717fdf4d47e42874aa6ab43e57bacb9bce5342d0b2c1065d1486512f4"
    },
    {
      "path": "chapters/ch1/muc-III-1.html",
      "sizeBytes": 819,
      "sha256": "05b95a21cd7c262d498a9c661bacdd6fa250b0cb8256a9c626ba0e1c2a700970"
    },
    {
      "path": "chapters/ch1/muc-III-2.html",
      "sizeBytes": 1023,
      "sha256": "e1d63bb50afb7d7224fc8ed3d74ec689c96dcd5896eb5478716981c4b9bff868"
    },
    {
      "path": "chapters/ch1/muc-III-3.html",
      "sizeBytes": 973,
      "sha256": "cdb871bbbd531cfecce529b1b66d0c8238e317238113f1370797df275fdcba0a"
    },
    {
      "path": "chapters/ch1/muc-III-4.html",
      "sizeBytes": 732,
      "sha256": "a8fb3b51d10232dee6c00e6fef703ab05f1ff3e7c85ca43a934db613990002a3"
    },
    {
      "path": "chapters/ch1/muc-III-5.html",
      "sizeBytes": 699,